{"schema_id":"urn:serenity:schema:qa-case:1","case_id":"degraded-data-det-02","family":"degraded-data","prompt":"Assess the supplied company record with its unresolved data quality issues and identify the next verification step.","cutoff":"2026-08-17T00:00:00Z","expected_invariants":["identity/data conflict remains explicit","BLOCKED action prevents finalization"],"isolation_policy":{"exclude_prior_verdicts":true,"exclude_corpus_answers":true,"network_mode":"offline"}}
