{"schema_id":"urn:serenity:schema:qa-case:1","case_id":"physical-ai-det-02","family":"physical-ai","prompt":"Trace the manufacturing dependencies in this robotics record and distinguish direct scarcity from a thematic US-listed vehicle.","cutoff":"2026-08-17T00:00:00Z","expected_invariants":["recursive bottom hop is named","sibling and second-order actor are explicit"],"isolation_policy":{"exclude_prior_verdicts":true,"exclude_corpus_answers":true,"network_mode":"offline"}}
