{"schema_id":"urn:serenity:schema:qa-case:1","case_id":"physical-ai-live-01","family":"physical-ai","prompt":"Using the recorded evidence, map the relevant physical bottleneck and the limits of the available US-listed expression.","cutoff":"2026-08-17T00:00:00Z","expected_invariants":["recursive bottom hop is named","sibling and second-order actor are explicit"],"isolation_policy":{"exclude_prior_verdicts":true,"exclude_corpus_answers":true,"network_mode":"live"}}
