{"schema_id":"urn:serenity:schema:qa-case:1","case_id":"discovery-det-01","family":"discovery","prompt":"Map the industrial dependency in the supplied record and compare the available US-listed ways to express it.","cutoff":"2026-08-17T00:00:00Z","expected_invariants":["US-listed resolution status is explicit without invented identity linkage","candidate distinctions are evidence-backed"],"isolation_policy":{"exclude_prior_verdicts":true,"exclude_corpus_answers":true,"network_mode":"offline"}}
