{"schema_id":"urn:serenity:schema:qa-case:1","case_id":"single-ticker-live-01","family":"single-ticker","prompt":"Using the recorded issuer evidence, assess what remains to be verified before acting on this US-listed name.","cutoff":"2026-08-17T00:00:00Z","expected_invariants":["identity conflict blocks action","conditional entry and bear case are separate"],"isolation_policy":{"exclude_prior_verdicts":true,"exclude_corpus_answers":true,"network_mode":"live"}}
