{"schema_id":"urn:serenity:schema:qa-case:1","case_id":"single-ticker-det-01","family":"single-ticker","prompt":"Review the supplied issuer dossier and explain what a US-listed investor should establish before taking a position.","cutoff":"2026-08-17T00:00:00Z","expected_invariants":["identity conflict blocks action","conditional entry and bear case are separate"],"isolation_policy":{"exclude_prior_verdicts":true,"exclude_corpus_answers":true,"network_mode":"offline"}}
