{"schema_id":"urn:serenity:schema:qa-case:1","case_id":"near-miss-det-01","family":"near-miss","prompt":"Assess whether the supplied foreign or indirect opportunity offers a usable US-listed vehicle, or belongs on a watchlist instead.","cutoff":"2026-08-17T00:00:00Z","expected_invariants":["no clean vehicle is preserved","no unsupported US-listed action is taken"],"isolation_policy":{"exclude_prior_verdicts":true,"exclude_corpus_answers":true,"network_mode":"offline"}}
