{"schema_id":"urn:serenity:schema:qa-case:1","case_id":"degraded-data-live-01","family":"degraded-data","prompt":"Using the recorded data, assess this issuer while keeping unresolved identity and availability issues visible.","cutoff":"2026-08-17T00:00:00Z","expected_invariants":["identity/data conflict remains explicit","BLOCKED action prevents finalization"],"isolation_policy":{"exclude_prior_verdicts":true,"exclude_corpus_answers":true,"network_mode":"live"}}
