{"schema_id":"urn:serenity:schema:qa-case:1","case_id":"displacement-fear-live-01","family":"displacement-fear","prompt":"Use the recorded evidence to examine a claimed displacement event before deciding whether the selloff changes forward economics.","cutoff":"2026-08-17T00:00:00Z","expected_invariants":["mechanical claim tested before sentiment","forward economics and falsifier remain separate"],"isolation_policy":{"exclude_prior_verdicts":true,"exclude_corpus_answers":true,"network_mode":"live"}}
