{"schema_id":"urn:serenity:schema:qa-case:1","case_id":"single-ticker-det-02","family":"single-ticker","prompt":"Assess this issuer from the supplied filing facts and identify the information that should govern a conditional investment decision.","cutoff":"2026-08-17T00:00:00Z","expected_invariants":["identity conflict blocks action","conditional entry and bear case are separate"],"isolation_policy":{"exclude_prior_verdicts":true,"exclude_corpus_answers":true,"network_mode":"offline"}}
