{"schema_id":"urn:serenity:schema:qa-case:1","case_id":"displacement-fear-det-01","family":"displacement-fear","prompt":"A stock dropped on a claimed design loss. Test the mechanical claim in the supplied record before drawing a market conclusion.","cutoff":"2026-08-17T00:00:00Z","expected_invariants":["mechanical claim tested before sentiment","forward economics and falsifier remain separate"],"isolation_policy":{"exclude_prior_verdicts":true,"exclude_corpus_answers":true,"network_mode":"offline"}}
