{"schema_id":"urn:serenity:schema:qa-case:1","case_id":"discovery-det-02","family":"discovery","prompt":"A specialist supplier may be hard to access directly. Use the supplied record to identify the practical US-listed route and its limitations.","cutoff":"2026-08-17T00:00:00Z","expected_invariants":["US-listed resolution status is explicit without invented identity linkage","candidate distinctions are evidence-backed"],"isolation_policy":{"exclude_prior_verdicts":true,"exclude_corpus_answers":true,"network_mode":"offline"}}
