{"schema_id":"urn:serenity:schema:qa-case:1","case_id":"displacement-fear-det-02","family":"displacement-fear","prompt":"Investigate the supplied displacement headline by tracing the engineering and commercial timing before reacting to sentiment.","cutoff":"2026-08-17T00:00:00Z","expected_invariants":["mechanical claim tested before sentiment","forward economics and falsifier remain separate"],"isolation_policy":{"exclude_prior_verdicts":true,"exclude_corpus_answers":true,"network_mode":"offline"}}
