{"schema_id":"urn:serenity:schema:qa-case:1","case_id":"physical-ai-det-01","family":"physical-ai","prompt":"For this Physical AI buildout, trace the supplied production chain to its scarcest physical step and identify the investable US expression, if one exists.","cutoff":"2026-08-17T00:00:00Z","expected_invariants":["recursive bottom hop is named","sibling and second-order actor are explicit"],"isolation_policy":{"exclude_prior_verdicts":true,"exclude_corpus_answers":true,"network_mode":"offline"}}
